{
  "$schema": "https://json-schema.org/draft/2020-12/schema",
  "type": "object",
  "properties": {
    "schemaVersion": {
      "type": "number",
      "const": 1
    },
    "festival": {
      "type": "object",
      "properties": {
        "name": {
          "type": "string"
        },
        "year": {
          "type": "integer",
          "minimum": -9007199254740991,
          "maximum": 9007199254740991
        },
        "startDate": {
          "type": "string",
          "pattern": "^\\d{4}-\\d{2}-\\d{2}$"
        },
        "endDate": {
          "type": "string",
          "pattern": "^\\d{4}-\\d{2}-\\d{2}$"
        }
      },
      "required": [
        "name",
        "year",
        "startDate",
        "endDate"
      ],
      "additionalProperties": false
    },
    "generatedAt": {
      "type": "string"
    },
    "films": {
      "type": "array",
      "items": {
        "type": "object",
        "properties": {
          "id": {
            "type": "string",
            "minLength": 1
          },
          "title": {
            "type": "string",
            "minLength": 1
          },
          "directors": {
            "type": "array",
            "items": {
              "type": "string"
            }
          },
          "writers": {
            "type": "array",
            "items": {
              "type": "string"
            }
          },
          "cast": {
            "type": "array",
            "items": {
              "type": "string"
            }
          },
          "countries": {
            "type": "array",
            "items": {
              "type": "string"
            }
          },
          "year": {
            "anyOf": [
              {
                "type": "integer",
                "minimum": -9007199254740991,
                "maximum": 9007199254740991
              },
              {
                "type": "null"
              }
            ]
          },
          "runtimeMinutes": {
            "anyOf": [
              {
                "type": "integer",
                "exclusiveMinimum": 0,
                "maximum": 9007199254740991
              },
              {
                "type": "null"
              }
            ]
          },
          "languages": {
            "type": "array",
            "items": {
              "type": "string"
            }
          },
          "strand": {
            "type": [
              "string",
              "null"
            ]
          },
          "synopsis": {
            "type": "string"
          },
          "writeupHtml": {
            "type": "string"
          },
          "image": {
            "anyOf": [
              {
                "type": "object",
                "properties": {
                  "thumb": {
                    "type": "string"
                  },
                  "detail": {
                    "type": "string"
                  },
                  "sourceUrl": {
                    "type": "string"
                  }
                },
                "required": [
                  "thumb",
                  "detail",
                  "sourceUrl"
                ],
                "additionalProperties": false
              },
              {
                "type": "null"
              }
            ]
          },
          "sourceUrl": {
            "type": "string"
          },
          "scrapedAt": {
            "type": "string"
          },
          "screenings": {
            "minItems": 1,
            "type": "array",
            "items": {
              "type": "object",
              "properties": {
                "id": {
                  "type": "string",
                  "minLength": 1
                },
                "start": {
                  "type": "string",
                  "pattern": "^\\d{4}-\\d{2}-\\d{2}T\\d{2}:\\d{2}(:\\d{2})?[+-]\\d{2}:\\d{2}$"
                },
                "end": {
                  "type": "string",
                  "pattern": "^\\d{4}-\\d{2}-\\d{2}T\\d{2}:\\d{2}(:\\d{2})?[+-]\\d{2}:\\d{2}$"
                },
                "venueRaw": {
                  "type": "string"
                },
                "venue": {
                  "type": "string",
                  "minLength": 1
                },
                "screen": {
                  "type": [
                    "string",
                    "null"
                  ]
                },
                "bookingUrl": {
                  "type": [
                    "string",
                    "null"
                  ]
                },
                "noteRaw": {
                  "type": [
                    "string",
                    "null"
                  ]
                }
              },
              "required": [
                "id",
                "start",
                "end",
                "venueRaw",
                "venue",
                "screen",
                "bookingUrl",
                "noteRaw"
              ],
              "additionalProperties": false
            }
          }
        },
        "required": [
          "id",
          "title",
          "directors",
          "writers",
          "cast",
          "countries",
          "year",
          "runtimeMinutes",
          "languages",
          "strand",
          "synopsis",
          "writeupHtml",
          "image",
          "sourceUrl",
          "scrapedAt",
          "screenings"
        ],
        "additionalProperties": false
      }
    }
  },
  "required": [
    "schemaVersion",
    "festival",
    "generatedAt",
    "films"
  ],
  "additionalProperties": false
}
