{
  "schemaVersion": 1,
  "festival": {
    "name": "Sample Film Festival (fictional data)",
    "year": 2025,
    "startDate": "2025-10-08",
    "endDate": "2025-10-19"
  },
  "generatedAt": "2025-09-01T12:00:00Z",
  "films": [
    {
      "id": "the-glass-harbour",
      "title": "The Glass Harbour",
      "directors": ["Ingrid Halvorsen"],
      "writers": ["Ingrid Halvorsen", "Tomas Berg"],
      "cast": ["Maren Lindqvist", "Olafur Skarsson", "June Ekwueme"],
      "countries": ["Norway", "UK"],
      "year": 2025,
      "runtimeMinutes": 128,
      "languages": ["Norwegian", "English"],
      "strand": "Headline Galas",
      "synopsis": "A lighthouse keeper's daughter returns to a fjord town transformed by a mysterious glassworks.",
      "writeupHtml": "<p>Halvorsen's third feature is her most assured yet: a slow-burning coastal fable in which grief and industry are fused, quite literally, in molten glass. Returning home for her father's funeral, marine engineer Solveig finds the family lighthouse decommissioned and the town in thrall to a glassworks whose furnaces never cool.</p><p>Shot on the Helgeland coast in shimmering 35mm, this is filmmaking of rare tactility — you can feel the heat of the foundry and the sting of the spray. Lindqvist gives a career-best performance as a woman learning that some inheritances are better shattered. A gala in every sense.</p>",
      "image": {
        "thumb": "images/thumb/the-glass-harbour.jpg",
        "detail": "images/detail/the-glass-harbour.jpg",
        "sourceUrl": "sample-placeholder"
      },
      "sourceUrl": "https://example.org/sample/the-glass-harbour",
      "scrapedAt": "2025-09-01T12:00:00Z",
      "screenings": [
        {
          "id": "the-glass-harbour#2025-10-09T20:45#royal-festival-hall",
          "start": "2025-10-09T20:45:00+01:00",
          "end": "2025-10-09T22:53:00+01:00",
          "venueRaw": "Southbank Centre",
          "venue": "royal-festival-hall",
          "screen": null,
          "bookingUrl": null,
          "noteRaw": "+ intro and Q&A with Ingrid Halvorsen"
        },
        {
          "id": "the-glass-harbour#2025-10-10T12:00#vue-west-end-7",
          "start": "2025-10-10T12:00:00+01:00",
          "end": "2025-10-10T14:08:00+01:00",
          "venueRaw": "Vue West End Screen 7",
          "venue": "vue-west-end",
          "screen": "Screen 7",
          "bookingUrl": null,
          "noteRaw": null
        },
        {
          "id": "the-glass-harbour#2025-10-11T15:15#curzon-mayfair",
          "start": "2025-10-11T15:15:00+01:00",
          "end": "2025-10-11T17:23:00+01:00",
          "venueRaw": "Curzon Mayfair",
          "venue": "curzon-mayfair",
          "screen": null,
          "bookingUrl": null,
          "noteRaw": null
        }
      ]
    },
    {
      "id": "mother-kim-daeyoung",
      "title": "Mother",
      "directors": ["Kim Dae-young"],
      "writers": ["Kim Dae-young"],
      "cast": ["Park Soo-min", "Lee Ha-eun"],
      "countries": ["South Korea"],
      "year": 2025,
      "runtimeMinutes": 109,
      "languages": ["Korean"],
      "strand": "Official Competition",
      "synopsis": "A midwife in a snowbound village delivers a child she believes she has met before.",
      "writeupHtml": "<p>Not to be confused with the Irish drama of the same title elsewhere in this year's programme — Kim's film is a wintry, quietly devastating study of memory and duty. As midwife Yeon-hee attends a difficult birth during the worst blizzard in a generation, she becomes convinced the child is somehow familiar.</p><p>Kim directs with extraordinary restraint, letting long takes and the muffled acoustics of snowfall do the emotional work. The final reel recontextualises everything before it without a single line of exposition.</p>",
      "image": {
        "thumb": "images/thumb/mother-kim-daeyoung.jpg",
        "detail": "images/detail/mother-kim-daeyoung.jpg",
        "sourceUrl": "sample-placeholder"
      },
      "sourceUrl": "https://example.org/sample/mother-kim-daeyoung",
      "scrapedAt": "2025-09-01T12:00:00Z",
      "screenings": [
        {
          "id": "mother-kim-daeyoung#2025-10-10T18:10#curzon-soho-1",
          "start": "2025-10-10T18:10:00+01:00",
          "end": "2025-10-10T19:59:00+01:00",
          "venueRaw": "Curzon Soho Screen 1",
          "venue": "curzon-soho",
          "screen": "Screen 1",
          "bookingUrl": null,
          "noteRaw": null
        },
        {
          "id": "mother-kim-daeyoung#2025-10-12T14:30#bfi-southbank-nft1",
          "start": "2025-10-12T14:30:00+01:00",
          "end": "2025-10-12T16:19:00+01:00",
          "venueRaw": "BFI Southbank NFT1",
          "venue": "bfi-southbank",
          "screen": "NFT1",
          "bookingUrl": null,
          "noteRaw": null
        }
      ]
    },
    {
      "id": "mother-aoife-brennan",
      "title": "Mother",
      "directors": ["Aoife Brennan"],
      "writers": ["Aoife Brennan", "Ciara Doyle"],
      "cast": ["Sinead Gallagher", "Padraig Moore", "Roisin Kelly"],
      "countries": ["Ireland"],
      "year": 2025,
      "runtimeMinutes": 96,
      "languages": ["English", "Irish"],
      "strand": "Debate",
      "synopsis": "Three generations of Donegal women spend one last night in the family pub before its sale.",
      "writeupHtml": "<p>The other <em>Mother</em> of this year's festival — and proof that a title can contain multitudes. Brennan's debut confines itself to a single night in a pub on the Donegal coast, as grandmother, daughter and granddaughter pull their last pints and settle forty years of scores.</p><p>What could have been a stage play in disguise becomes something looser and stranger, punctuated by karaoke, a power cut, and one of the great drunken monologues of recent Irish cinema.</p>",
      "image": null,
      "sourceUrl": "https://example.org/sample/mother-aoife-brennan",
      "scrapedAt": "2025-09-01T12:00:00Z",
      "screenings": [
        {
          "id": "mother-aoife-brennan#2025-10-10T20:30#curzon-soho-2",
          "start": "2025-10-10T20:30:00+01:00",
          "end": "2025-10-10T22:06:00+01:00",
          "venueRaw": "Curzon Soho Screen 2",
          "venue": "curzon-soho",
          "screen": "Screen 2",
          "bookingUrl": null,
          "noteRaw": null
        },
        {
          "id": "mother-aoife-brennan#2025-10-13T13:00#ica",
          "start": "2025-10-13T13:00:00+01:00",
          "end": "2025-10-13T14:36:00+01:00",
          "venueRaw": "ICA",
          "venue": "ica",
          "screen": null,
          "bookingUrl": null,
          "noteRaw": null
        }
      ]
    },
    {
      "id": "senkyo-no-ato",
      "title": "選挙のあと (After the Election)",
      "directors": ["Sato Yuki"],
      "writers": ["Sato Yuki"],
      "cast": ["Watanabe Ren", "Kobayashi Mio"],
      "countries": ["Japan"],
      "year": 2024,
      "runtimeMinutes": 142,
      "languages": ["Japanese"],
      "strand": "Journey",
      "synopsis": "A defeated rural mayor drives his campaign van across Honshu returning every donation in person.",
      "writeupHtml": "<p>Sato's deadpan road movie begins where most political dramas end: the morning after a landslide defeat. Rather than concede gracefully, 68-year-old mayor Toshio loads his loudhailer van with envelopes of cash and sets out to return every campaign donation — all 1,214 of them — by hand.</p><p>At 142 minutes it is unhurried by design; the film accumulates its meaning the way the van accumulates dents. A wry, humane epic of obligation, and a sneaky portrait of a Japan rarely seen on screen.</p>",
      "image": {
        "thumb": "images/thumb/senkyo-no-ato.jpg",
        "detail": "images/detail/senkyo-no-ato.jpg",
        "sourceUrl": "sample-placeholder"
      },
      "sourceUrl": "https://example.org/sample/senkyo-no-ato",
      "scrapedAt": "2025-09-01T12:00:00Z",
      "screenings": [
        {
          "id": "senkyo-no-ato#2025-10-11T17:45#bfi-southbank-nft3",
          "start": "2025-10-11T17:45:00+01:00",
          "end": "2025-10-11T20:07:00+01:00",
          "venueRaw": "BFI Southbank NFT3",
          "venue": "bfi-southbank",
          "screen": "NFT3",
          "bookingUrl": null,
          "noteRaw": null
        }
      ]
    },
    {
      "id": "wax-and-wane-shorts",
      "title": "Wax and Wane: Animated Shorts",
      "directors": [],
      "writers": [],
      "cast": [],
      "countries": ["Various"],
      "year": 2025,
      "runtimeMinutes": 84,
      "languages": ["Various"],
      "strand": "Shorts",
      "synopsis": "Seven animated shorts about cycles, seasons and repetition, from stop-motion beeswax to hand-drawn charcoal.",
      "writeupHtml": "<p>This year's animation programme orbits a single theme: things that return. Highlights include <em>Candlemas</em>, a Latvian stop-motion piece animated entirely in beeswax that took its director six years; the charcoal loop-film <em>Roundel</em>; and <em>Low Tide</em>, in which a Cornish estuary empties and refills in eleven hypnotic minutes.</p><p>As ever with the shorts strands, the pleasure is in the whiplash — no two consecutive films share a technique, a tone or a continent.</p>",
      "image": null,
      "sourceUrl": "https://example.org/sample/wax-and-wane-shorts",
      "scrapedAt": "2025-09-01T12:00:00Z",
      "screenings": [
        {
          "id": "wax-and-wane-shorts#2025-10-12T12:15#ica",
          "start": "2025-10-12T12:15:00+01:00",
          "end": "2025-10-12T13:39:00+01:00",
          "venueRaw": "ICA",
          "venue": "ica",
          "screen": null,
          "bookingUrl": null,
          "noteRaw": "+ Q&A with the programmers"
        },
        {
          "id": "wax-and-wane-shorts#2025-10-14T18:30#prince-charles",
          "start": "2025-10-14T18:30:00+01:00",
          "end": "2025-10-14T19:54:00+01:00",
          "venueRaw": "Prince Charles Cinema",
          "venue": "prince-charles",